id,nombre,costo,descripcion
3576,write,181,Throw know surface. Common cause per.
3577,military,85,Set trade pass worker medical create skin.
3578,put,197,Magazine message admit weight provide.
3579,south,64,Place throw participant bed hot as.
3580,design,41,Give lead field.
3581,newspaper,59,Religious pay a red add hand should.
3582,leave,11,Lead eye free evening hot visit term.
3583,democratic,191,Treat right ability again determine go left.
3584,house,135,Answer however voice there team event apply.
3585,play,62,Market ago kitchen leader increase.
3586,particularly,166,Expect me throw floor left difference.
3587,home,120,Central police forget black or day treat.
3588,resource,160,Store issue decade matter although win.
3589,that,81,Look find even but name data force. Way book to.
3590,law,54,Unit street save. Very can lay nature house no.
3591,speech,84,Myself behind away guess us.
3592,three,196,Life response issue let prevent.
3593,mouth,49,First understand official raise.
3594,suggest,70,Onto else this star describe girl.
3595,fine,141,Rise serve long opportunity couple task.
3596,firm,151,Call hit less more beautiful special thus enter.
3597,near,73,Create real fact bit possible.
3598,sit,15,Form similar even. Apply evidence amount century.
3599,want,124,Method region western. About rule by.
3600,own,178,Six bring such nice four clear author.
3601,leave,16,Worker true student.
3602,writer,191,Girl blood leg heart culture she.
3603,including,130,Third walk trial bad cold.
3604,over,106,Likely home parent. Beat wish beyond.
3605,morning,65,Prevent his reduce add forward.
3606,believe,176,Staff maybe recently skill image law war.
3607,likely,131,Peace theory hit thousand bar while.
3608,two,82,Most between likely realize each.
3609,friend,108,As assume piece environmental system church.
3610,throughout,142,Myself plant investment tough cover.
3611,focus,21,Ten travel ahead environmental.
3612,second,41,Mission easy as life turn but picture.
3613,upon,42,Free individual south.
3614,see,126,Price fill group vote.
3615,age,96,Fear lead former training.
3616,item,149,Act friend job yeah recognize.
3617,clear,133,Movie out spring bring hot several enter.
3618,vote,157,Method no yeah their piece remain occur.
3619,group,133,Increase American participant.
3620,very,196,Their interview gun describe.
3621,care,165,Since situation system.
3622,believe,24,Water ready floor account.
3623,star,44,Table process whole.
3624,evening,127,Property enjoy second over skill step.
3625,around,105,Night project this class.
3626,do,117,Add claim improve standard community.
3627,five,57,Day trip end seem education.
3628,perform,34,Culture difference discover need.
3629,often,60,Nice another set long determine together.
3630,building,64,Build others serious might admit cut.
3631,view,172,Become teacher program fall always.
3632,manage,27,Middle may of beyond military for face concern.
3633,identify,22,Know size stay it attorney although item.
3634,friend,30,Call church top concern. Home probably require.
3635,score,72,Management media action head feel onto sit.
3636,require,177,Discussion crime bag free.
3637,strategy,190,Money even really machine economy.
3638,nation,85,Throw fire step four rich.
3639,ability,100,Fact economic summer.
3640,performance,121,Walk fund contain century lead side civil.
3641,though,102,Bad week help point.
3642,only,137,Western try ground world mean.
3643,along,58,Wait another course can. I same spring than.
3644,you,138,Trial offer unit process necessary personal less.
3645,fear,193,Test land community project.
3646,network,64,Relationship personal soon.
3647,vote,183,Benefit commercial executive manager their from.
3648,rise,165,Apply sense tell good let success manage lawyer.
3649,little,155,Notice second entire four buy.
3650,bill,117,Degree during anything win lead.
3651,thought,20,General never summer step inside.
3652,security,100,If authority agency month model.
3653,determine,111,Set once big party experience. Pm partner play.
3654,power,199,Second well police right direction happen.
3655,experience,39,Main land power protect.
3656,goal,107,Food place add. You skill go product expect.
3657,my,102,Protect still continue above.
3658,different,10,Party food upon down a theory.
3659,still,80,Toward use war some.
3660,read,176,Beautiful director long happen reason.
3661,degree,96,Must present public stand about accept allow.
3662,past,60,Professional have indicate finish.
3663,government,88,Age decide include issue month senior type cover.
3664,thank,19,Commercial set whose ten never.
3665,money,11,Somebody field be rock increase quickly team.
3666,nature,119,Treat attorney serve.
3667,compare,57,Individual six term church.
3668,whether,124,Rule short approach reach be.
3669,senior,195,Chair team thought responsibility operation.
3670,blood,135,Situation late debate.
3671,ever,100,Down serious television happen exactly.
3672,list,128,Business over region easy.
3673,artist,127,Modern record size need position couple.
3674,like,31,Network receive program employee.
3675,beyond,132,Attack space police deep. Low eye last.
3676,cultural,26,Show over election trip dark would newspaper.
3677,put,144,Laugh arm which sing magazine minute catch.
3678,national,164,Actually food rate one both bad night some.
3679,audience,158,Expect mission turn usually forget skin cell.
3680,about,75,Method father choice nature enough their per.
3681,talk,36,Travel certainly argue your everything.
3682,close,21,Could my little marriage everything.
3683,school,125,Laugh past for hand game a.
3684,medical,80,Executive which well truth father.
3685,enough,162,Room state seven among either choose.
3686,address,157,Since do computer affect third.
3687,letter,130,History mission production talk purpose.
3688,entire,76,Follow south different wait spend.
3689,serious,87,Person player sometimes above.
3690,hard,148,Open yourself probably.
3691,conference,125,Other election positive sometimes.
3692,structure,193,Theory him manager PM short fast.
3693,act,49,Establish part boy size dinner let strategy.
3694,beat,62,Detail single course human throughout add.
3695,area,155,Rule since wear low leg cell couple difference.
3696,mouth,126,Education interest machine Mr.
3697,ball,172,Factor five market customer movie.
3698,question,144,School edge third someone.
3699,one,160,Benefit he then exist.
3700,natural,175,Face up majority conference hospital community.
3701,more,13,Seat watch forget wind to.
3702,tell,168,Edge think social conference him push local.
3703,road,48,Culture break country provide.
3704,reality,126,Story home quickly school develop true.
3705,best,147,Thing organization if meeting.
3706,court,81,Serious too cut ahead almost do.
3707,of,127,Hospital style American audience.
3708,machine,122,Four prevent debate movement health serious much.
3709,person,42,Lose member above necessary.
3710,low,83,Cup boy company collection than recognize real.
3711,try,150,Maintain early understand.
3712,capital,65,Serve save election onto into would now.
3713,return,178,Capital far yes behind grow run animal.
3714,information,115,Quickly move lay somebody whether.
3715,last,174,Knowledge young wear staff lawyer ahead.
3716,only,22,Read rather budget military from behind space.
3717,piece,81,In every window less dream industry vote.
3718,happy,57,Never walk whom.
3719,again,159,Mind attention include gas wear class reveal.
3720,help,150,Low they off than true.
3721,season,67,Fine even whatever run dog. Listen media fear.
3722,thank,112,Maintain item defense sometimes discuss.
3723,top,77,Arrive task law draw night bill stand.
3724,officer,166,Defense also operation.
3725,fill,138,Score stay major buy job. Whole discuss thing.
3726,late,90,Exactly fire still any deep know.
3727,may,149,Baby floor east ability first ever community.
3728,ability,21,Affect work their war interview.
3729,age,104,Have standard pretty manager use adult interest.
3730,view,104,Up else someone address bed.
3731,effort,108,Prove shoulder pattern.
3732,involve,57,Western speak back office relate.
3733,subject,61,Ground able huge a respond new wait.
3734,any,13,Event reduce ok.
3735,church,144,Day likely decade as available hand.
3736,will,10,Recently discussion stop toward.
3737,then,104,Soon how this ahead several student.
3738,participant,135,Citizen gun time enter hit.
3739,image,178,Set fill group kid.
3740,six,90,Out fire sure shake.
3741,job,70,Stay argue might hospital opportunity edge.
3742,run,86,Pass which grow.
3743,professional,12,Real pressure law customer.
3744,peace,79,Lead think sometimes catch surface.
3745,movement,129,Himself artist put discover.
3746,challenge,117,Suggest sit others something.
3747,response,88,Learn third hear way tend society.
3748,direction,195,Who pull else special. State manager east.
3749,happen,141,Along agree argue professional thing through.
3750,commercial,83,Bring sell only agent away measure perform.
3751,major,16,Good project year need toward focus.
3752,tough,183,Open ground until course sometimes sit.
3753,hear,198,Recently fact speak yourself various bit under.
3754,they,82,Against different chair our too.
3755,soldier,113,Skill live live garden manager no.
3756,authority,23,Rule another still wonder.
3757,more,188,Teach apply clear in artist beautiful life argue.
3758,PM,178,Speak example its second site last.
3759,worry,72,Measure clear capital either.
3760,design,95,Process stuff people tree husband every service.
3761,weight,168,Else face see lead no herself.
3762,while,69,Environment audience explain article.
3763,audience,121,Test meeting bank very voice.
3764,your,186,Fact yourself look center activity avoid.
3765,notice,33,Professor appear provide.
3766,course,70,Front shoulder life oil.
3767,team,106,Finally particular hotel president.
3768,threat,168,Close I feeling several have spend source.
3769,place,114,Avoid focus suggest size collection goal.
3770,suggest,174,Let teach space factor water reason.
3771,vote,101,Least food between today happen president.
3772,beautiful,46,Will pressure cover party set.
3773,such,181,Group stop computer century.
3774,film,51,Lawyer walk model.
3775,question,179,Officer attorney party if national positive hot.
3776,attention,47,She yard subject share beat remember.
3777,training,98,Well than television dark real more process.
3778,every,191,Large have leave.
3779,organization,130,Save director yet approach.
3780,write,159,Debate site financial less rather find spring.
3781,personal,108,Drop address few happen usually.
3782,change,86,Station buy join.
3783,level,129,Author occur skill within wait occur receive.
3784,decision,199,While peace measure someone.
3785,low,27,Long tend old only television fall.
3786,argue,163,Question area wife politics almost its.
3787,throughout,59,Home nice management almost defense.
3788,young,136,Computer fly toward begin cut.
3789,no,68,Common find former effort. Maybe pull walk.
3790,throw,113,Control occur garden teach of medical senior.
3791,board,155,Explain page see like gun business page.
3792,production,143,Across drive wonder traditional style spend.
3793,style,93,Read bit attention. East do big chance.
3794,low,196,Budget if street large card black oil.
3795,rather,100,Alone make especially.
3796,show,106,Piece ball fish current skin member.
3797,moment,32,Enjoy young choice stay relate production.
3798,care,93,Bad reduce go discussion act.
3799,provide,148,May message where idea consumer focus one speech.
3800,another,172,Catch however television yet above a.
3801,official,53,Knowledge particular range decade west.
3802,mother,149,Kind ahead live form gas. Day strategy magazine.
3803,one,126,Through way act develop right list decade.
3804,leave,13,He way manager avoid.
3805,bag,134,Interesting stage impact responsibility return.
3806,one,189,North eye dark. Drug important exist approach.
3807,senior,87,Bag international contain woman professor sign.
3808,new,90,Point whatever image box opportunity.
3809,play,69,Key particular hot show when be past suggest.
3810,how,155,Television even science nature.
3811,teacher,194,Beat security way instead.
3812,effect,116,Painting first walk.
3813,four,104,Many stand drug send minute live.
3814,event,56,Under if improve attention.
3815,seven,197,Memory focus get quality.
3816,mouth,186,Executive argue certainly new stop.
3817,eye,37,Century region together baby.
3818,edge,14,Side tough beyond government bank entire.
3819,task,97,Want structure hair away group.
3820,explain,166,Present stock amount Mr part.
3821,whom,179,Specific voice message into foot sure body.
3822,wear,13,Hand rise thus stay.
3823,drive,177,Follow like down describe.
3824,create,74,Personal industry whole there.
3825,movement,73,Walk perform establish task. Dark early example.
3826,subject,108,Free else important more.
3827,understand,68,Practice throw nice.
3828,new,93,Eight own range short far these threat.
3829,energy,139,Area news seat ability.
3830,thing,10,Subject huge feeling bank wait somebody line.
3831,else,184,Response ask adult among woman.
3832,single,97,Food anything happy myself.
3833,many,115,Child close teacher history.
3834,sister,160,Front month list wish believe billion.
3835,soldier,116,Life consider often during how strong form.
3836,anyone,35,Hair question around measure.
3837,news,47,Report bill check he.
3838,well,49,Technology hard mean one audience.
3839,interest,60,National pick such knowledge over economic may.
3840,whether,196,Mind simply full. Sound blue occur.
3841,specific,109,Loss none both spend.
3842,act,75,Drug fear note quality conference sit.
3843,traditional,188,You always clear goal agent grow.
3844,charge,53,Floor degree the I sit west great.
3845,seek,158,Under every think standard prove.
3846,claim,87,Building in poor focus company wish.
3847,activity,157,Sometimes newspaper technology discussion save.
3848,know,25,Medical bank hope everything time go wait.
3849,message,75,Whatever stay member ability method.
3850,series,122,Range participant sell if.
3851,husband,157,Onto rich economic.
3852,side,50,Magazine threat agree north possible.
3853,start,95,Day degree new particular protect.
3854,television,104,Land subject get other.
3855,better,90,Step become onto live training study.
3856,plan,89,Heavy nature his want. Without near face hair.
3857,good,50,Almost agreement very charge common best less.
3858,heart,91,Each whatever top truth everybody none try.
3859,generation,182,Politics political yourself bar role bank.
3860,charge,185,Now force tough lot part about news.
3861,happen,77,Coach morning charge and herself instead.
3862,recent,137,Do material his happy serious feel traditional.
3863,fish,185,Medical be worker low dog.
3864,training,187,Against difference notice born report left.
3865,major,61,Own east brother recently say stay place.
3866,only,121,Think sell this technology special.
3867,her,42,The value would member light five heart act.
3868,member,188,Thank last than soldier down local establish.
3869,more,59,Cup century appear. Alone security trade day.
3870,president,88,Painting PM argue sure southern subject hotel.
3871,environmental,38,Road sign throughout tough face message dark two.
3872,if,178,Director ok evidence under.
3873,kitchen,40,Call bank computer street wait trade.
3874,tonight,14,Far institution art major response many name.
3875,occur,47,Doctor receive will us arrive seven.
3876,medical,94,Cover rest exist give issue floor together who.
3877,compare,69,Light million moment address decade.
3878,system,54,Occur fine capital alone all spring.
3879,major,167,Clearly loss describe seek.
3880,suggest,45,Chance final later seek force thank her one.
3881,ready,93,Group role sort fund west rather their.
3882,artist,149,Same final clearly until forward play.
3883,street,97,Anything sit land degree over cover recently.
3884,business,37,Film in enough glass.
3885,at,182,Top red fine natural near week.
3886,raise,72,Treatment people person brother.
3887,attorney,79,Through middle claim skill political rock.
3888,glass,143,Can amount check.
3889,always,111,Enjoy take year American impact.
3890,Democrat,61,Mission far form necessary.
3891,watch,190,Present likely memory design system.
3892,commercial,27,Save join by raise exactly participant.
3893,western,195,Increase ball author teacher finish nature seat.
3894,police,200,First type purpose wide career.
3895,like,131,Usually summer often hotel significant.
3896,daughter,181,Before trade foreign with early home close whose.
3897,significant,18,Necessary give drug ever use control describe.
3898,campaign,165,Process be impact.
3899,important,62,Edge difficult at task others meet.
3900,these,51,Message home three finally reveal national.
3901,political,58,Community reality season unit.
3902,list,104,Table nice base security maintain travel.
3903,discuss,133,Help people marriage big.
3904,school,161,Huge little check any.
3905,natural,16,Brother heart yes kid relate unit.
3906,strong,184,Heart in account when eat owner.
3907,return,84,Group exactly travel baby behind admit cup.
3908,relate,80,Else stay away prepare.
3909,year,179,Ten concern environmental green sound why how.
3910,east,177,Room thousand radio professional into forget.
3911,student,163,Style tonight morning move voice us.
3912,oil,101,Go make town rise price. Part scene product.
3913,notice,86,Include low guy if here can make.
3914,break,195,Religious here history half method see fill.
3915,approach,106,New population court record poor represent.
3916,bill,147,Language meeting spend.
3917,movement,190,Political tell four.
3918,stand,78,Happy sing there remain technology.
3919,be,163,Sell writer indeed also very others.
3920,six,40,Either western idea program peace serve least.
3921,eye,193,Face box spend seek nothing.
3922,floor,190,Raise history then deep cold already.
3923,painting,88,Gun little drop significant eat.
3924,instead,48,List too lot nearly remain.
3925,some,61,Tax another final chair onto.
3926,someone,154,Long oil hit operation hotel.
3927,walk,183,Letter sort without run let.
3928,sing,98,Capital goal evidence responsibility war.
3929,agent,15,Call north level watch speak doctor father.
3930,contain,144,Onto everyone nearly skill.
3931,especially,147,Yeah Mr special buy.
3932,total,86,Specific their cover.
3933,career,169,Gas bed mission seat bed.
3934,response,130,Cell budget sister. Writer develop meet.
3935,protect,130,That cost contain area nearly.
3936,pull,194,Happy plant newspaper resource board analysis.
3937,offer,191,Per send knowledge still town hair range.
3938,current,39,Guy hour return southern become yet business.
3939,mother,64,Build today offer begin live quality.
3940,bar,43,Everyone trouble away sport.
3941,sit,56,Company fine hand reality treatment.
3942,adult,172,Say believe share letter exist magazine.
3943,factor,68,Player where respond level less people.
3944,entire,112,Red level view should few drive clear.
3945,throughout,72,Wait truth heavy model.
3946,up,74,Training quite cup process appear religious.
3947,yourself,174,Modern cause major this produce.
3948,total,81,Cold week kitchen general data threat safe.
3949,myself,52,Campaign water go official coach feeling car.
3950,beyond,103,Specific need population church.
3951,lawyer,111,Next current type increase cold carry.
3952,American,30,Unit our newspaper eight claim agency put.
3953,worker,166,Cost movie field build north across more.
3954,be,139,Beyond scene without cut.
3955,may,53,Radio successful though according girl stop.
3956,government,45,Throw real fear music whatever.
3957,support,166,Model grow audience smile affect dark.
3958,they,104,Term stuff station yet.
3959,card,146,Perhaps method yet father environmental into.
3960,type,64,Need opportunity performance during serious.
3961,consider,135,A soon party hair.
3962,animal,84,Theory which bed office position rise brother.
3963,federal,134,Reduce political sing tough bag.
3964,sometimes,104,Within deal argue style million.
3965,end,72,Consumer out scene past.
3966,single,70,Go fall small.
3967,late,72,Order according coach whether nice mouth picture.
3968,product,58,About suffer fast leader.
3969,grow,148,Soon focus financial seek deal machine study.
3970,property,59,Our door easy organization have.
3971,performance,29,Meet guy eat remember.
3972,up,92,Stop remember road scientist foreign.
3973,phone,92,Wife will specific today plan.
3974,section,17,From seek sort language president peace several.
3975,she,198,Religious network continue page top.
3976,sure,37,Sell against note contain find suffer coach.
3977,speech,106,Church two rule fire evening.
3978,case,27,Free company number phone model.
3979,would,68,Civil research us minute significant.
3980,author,59,Reach recent ability doctor court this.
3981,nation,108,Kid cup way who lot. Early bar really account.
3982,market,85,Serve senior open lot anything.
3983,who,35,Wear beautiful tell thus such health.
3984,your,172,Marriage people figure movement cover.
3985,which,189,Current someone start affect quite hot space.
3986,officer,64,Church despite fall decade.
3987,consider,173,Human meet wait probably.
3988,difficult,16,Before almost truth specific product size per.
3989,mean,153,Authority necessary figure meeting.
3990,Republican,20,Rule serve artist agree sit despite this.
3991,player,190,Join join fight simply voice.
3992,young,192,History century better fact make forward.
3993,tonight,200,Still happen person would among.
3994,another,74,Provide nearly tend across one reason.
3995,scene,17,Owner clear stand. Federal project name ahead.
3996,agency,76,Statement already health else my.
3997,attack,163,Laugh rather live indicate.
3998,minute,47,Important five around large whole.
3999,safe,53,Tend wear to form word.
4000,mean,165,Television himself best box listen air book.
4001,picture,111,House food stuff. Account down fast agent.
4002,bad,129,Teacher drop we point from. Account social trial.
4003,yourself,108,Road energy likely officer.
4004,this,188,Many current agree morning their enough.
4005,before,134,Civil identify share peace consider upon past.
4006,moment,152,Participant industry in piece bad young.
4007,run,107,Past federal foreign painting media quality.
4008,fund,23,Draw color you role many.
4009,drop,189,Nation despite good.
4010,TV,172,Forget difficult east meet.
4011,listen,69,Guess early maybe can perform baby.
4012,this,133,Art note argue water beautiful end.
4013,above,130,Describe mean pass page floor time very.
4014,account,73,Story vote analysis poor protect coach pull.
4015,young,196,Able be suddenly late.
4016,interest,150,Somebody deal reason moment cover director.
4017,contain,51,What author center guess onto agency board.
4018,firm,64,Between give system effect.
4019,class,67,Nation great full appear.
4020,serve,140,Law news grow production Mrs then option appear.
4021,rich,189,Against leg ground notice eat.
4022,feeling,197,City company television dark grow.
4023,her,62,Decision then authority assume wait.
4024,product,64,Father million cut adult. Way hold have.
4025,above,191,Assume dark who. Father policy eat point.
4026,including,55,Race big test rate alone else sense.
4027,value,113,Approach summer wish plant remember nice area.
4028,organization,27,Star response share notice key.
4029,energy,61,She bill perhaps now.
4030,suggest,101,Hear sport direction per drug style body.
4031,second,178,Seat another suddenly ten.
4032,cell,29,Budget large threat third sure.
4033,speak,183,Statement place form seat. Quite ever treat off.
4034,water,67,What nature deal action. Part son daughter face.
4035,call,118,Your or I even necessary air early.
4036,discuss,172,National lose research.
4037,condition,85,Unit result enter good sport.
4038,tend,189,Prevent main smile concern though it.
4039,service,78,Million watch magazine husband marriage prove.
4040,party,24,Catch get buy. Family visit often push exactly.
4041,million,50,Tv pay artist investment pay later million eight.
4042,scene,79,Only middle five yourself type already.
4043,water,92,Cut meet center art why compare.
4044,but,113,Huge the value know account.
4045,one,16,Produce nor job beat go again.
4046,lead,151,Lot one lawyer task school where on.
4047,floor,156,Herself loss ahead majority size visit field.
4048,challenge,170,High memory here church.
4049,fire,164,Economy high mind man partner relate.
4050,thought,79,Necessary audience trip week.
4051,lawyer,185,Year work player question lot stand value.
4052,home,101,Yet food exist capital traditional image general.
4053,happy,122,Take indeed during wrong beyond boy decision.
4054,painting,108,Unit finish factor seven.
4055,industry,171,Pass environmental language computer might allow.
4056,according,136,Miss both significant the word official minute.
4057,door,79,Forget writer cost east.
4058,later,182,Government data alone.
4059,citizen,119,Nature know fear student wide remember plan.
4060,discussion,38,Factor edge chair difference recent.
4061,performance,129,Former tonight this market town possible learn.
4062,today,79,Exist approach election visit west rock.
4063,customer,170,Ball last bar another game.
4064,bag,178,International hot approach. My campaign billion.
4065,visit,26,Democrat time guy military truth.
4066,decade,192,Month talk throw throw try quite.
4067,visit,54,Concern guy himself capital report hand husband.
4068,film,47,Area science allow begin indicate writer.
4069,blue,91,Often state window.
4070,listen,90,White whole relate five increase.
4071,PM,104,Create happy board board board she.
4072,billion,199,Simply less turn same once behind.
4073,start,182,Sign state job Mrs wear election.
4074,stay,147,Day price how realize stay management.
4075,job,18,Tv responsibility the image civil bed glass town.
4076,area,53,Old wind raise.
4077,I,121,Meet general finish meeting program as under.
4078,per,136,Put hope second particular.
4079,dream,68,Nature imagine drive ready environmental ok.
