id,nombre,costo,descripcion
1040,upon,116,Character peace form.
1041,exist,172,Enjoy hand attorney likely however them whole.
1042,risk,78,Management relate trouble themselves.
1043,commercial,107,Cell child theory camera act debate.
1044,one,36,Miss section race reality.
1045,herself,44,Image born within child support spring box bar.
1046,large,12,Bill usually quickly special society world.
1047,knowledge,20,Sound truth color artist husband wife.
1048,thought,68,Across white lot structure heart.
1049,suddenly,81,Bring amount leg boy.
1050,challenge,120,Instead technology war hope.
1051,cause,90,You face here simple call theory individual it.
1052,back,65,Beautiful plan contain thus prepare per parent.
1053,fact,115,Open certain treatment should store.
1054,break,144,Send much quickly might concern thing its.
1055,until,37,Approach artist policy behavior.
1056,information,128,At require church probably if quality.
1057,age,55,Happy determine already national opportunity.
1058,chance,156,Brother argue season little type month call.
1059,rich,29,Technology new magazine course.
1060,after,94,American most view. Say role she lead.
1061,eye,160,Night item avoid.
1062,father,183,Among help year country yourself.
1063,happy,187,Number task it heavy candidate phone.
1064,none,130,Support capital blue interview section.
1065,position,142,Doctor no forget box indicate feeling officer.
1066,list,71,They wear onto government.
1067,later,57,Receive ready early western kid.
1068,range,18,Cup agent second change. Get past about between.
1069,personal,191,Discuss thousand may.
1070,run,101,Which I gun protect view.
1071,again,121,Low tree four total. Deep sit fast else fish.
1072,usually,176,Small thing pattern capital design send.
1073,young,59,Final computer performance arm crime.
1074,this,62,Home theory series.
1075,tax,127,Hope rich catch painting offer rise.
1076,her,64,Fish material increase assume player check would.
1077,bar,129,Where either suggest thank share.
1078,scene,83,Tend do course two anything smile side.
1079,food,169,Loss wall attorney cup building he can.
1080,morning,11,Voice full long beyond. Local movement bed.
1081,save,63,Those go share action media foreign risk.
1082,general,42,Still why account enter some investment despite.
1083,life,186,Effect large local just analysis hot.
1084,test,161,Really will never popular agreement.
1085,serious,73,Somebody leader seek author animal.
1086,manage,143,Week participant she real campaign science try.
1087,rich,55,Late computer reflect.
1088,current,90,Keep deep imagine event.
1089,forward,98,Unit economic statement mission.
1090,meeting,40,Meet attorney structure she today fine both.
1091,they,162,Right accept economy thank national still raise.
1092,serious,25,Product account purpose control bag.
1093,several,60,Receive way drive very apply fly not.
1094,growth,91,Theory able apply three professional old.
1095,argue,104,Listen maintain only over local our camera ahead.
1096,accept,198,Lawyer full they yeah receive line level.
1097,despite,50,Resource manager expert teach.
1098,maintain,69,Rest PM order message decide network.
1099,success,69,Coach plant local minute.
1100,hundred,90,Thousand provide stuff work important arrive.
1101,industry,139,Ready sport keep page.
1102,item,132,Without wife high energy bit concern hope.
1103,decide,81,Work we data a.
1104,something,106,Then time direction sea stage parent make.
1105,best,166,Will usually house choose large tell.
1106,value,21,Within close movie build evening issue write.
1107,little,109,Subject easy left doctor no.
1108,time,72,Maybe buy fill every.
1109,short,25,General memory occur decision gas.
1110,ten,32,High hotel politics early about.
1111,almost,42,Among do best. Forward whom others young west.
1112,want,181,Agree decision hotel. Consider pick seven pick.
1113,rule,190,Could risk lead nation.
1114,dark,104,Continue many enter teach buy.
1115,understand,151,Here laugh rather blood.
1116,whose,82,Reduce care factor use soldier.
1117,per,159,Staff who and strategy understand.
1118,reality,114,Remain very education computer nearly.
1119,season,15,Common spring ball number discover receive own.
1120,them,82,Second letter know major natural.
1121,glass,103,Perhaps situation budget color station.
1122,part,94,Safe learn level property raise administration.
1123,point,163,Issue house you spring movement race agreement.
1124,within,85,Teacher lead determine simple these director.
1125,game,55,Use machine according body team feel main.
1126,it,147,Truth eight only run.
1127,big,194,Ability quite item science.
1128,game,64,Add past hold drive.
1129,according,119,Without line project father so audience.
1130,hand,183,Several late high.
1131,should,36,Official professional identify ten budget.
1132,concern,193,Stop safe happy.
1133,coach,130,Medical mother hear so somebody although dream.
1134,rock,100,Friend writer send state if range commercial.
1135,well,160,Million do firm offer meeting.
1136,strategy,148,Finally science so.
1137,room,181,Almost great sure degree.
1138,health,161,Reach away drug sister firm.
1139,both,180,Experience then issue understand yeah.
1140,push,10,Color agree material writer yard war sport.
1141,it,73,Painting outside ever nation response.
1142,phone,36,Ground pay reality science.
1143,recognize,23,Finally work officer smile ability.
1144,our,110,Son share whole fast lose last say.
1145,top,73,Wait section condition.
1146,practice,132,Figure network strong best work quite degree.
1147,power,168,Food edge available yet activity short.
1148,series,71,Within decade medical bank.
1149,marriage,83,Series record figure practice.
1150,beat,54,Star throw walk send appear sell color.
1151,perhaps,157,Increase which kind any note season.
1152,them,43,Responsibility assume laugh night but into skill.
1153,physical,142,Four man work loss second tend night.
1154,travel,144,As many mention doctor beautiful single yeah.
1155,similar,167,Partner situation under.
1156,need,195,Bag gun first prepare tax.
1157,adult,116,Sometimes country bad career firm fear.
1158,today,172,Son expect way south.
1159,event,186,Fall majority reflect actually.
1160,professor,154,Day enter professor school.
1161,year,100,Beyond value stand task door forget able weight.
1162,simply,42,Father move event project choose.
1163,local,186,Sometimes others become well thank scientist.
1164,station,198,Unit thus quickly box reveal.
1165,force,160,Somebody character common knowledge.
1166,strong,167,Why however heart candidate identify bill.
1167,lose,164,Report sound but sport safe approach.
1168,decision,87,Realize skill wall produce until.
1169,own,159,Decade most be food test.
1170,write,47,Easy three million growth.
1171,shake,193,Training number perhaps much result treat media.
1172,wife,46,Have ten moment director as imagine.
1173,step,80,Which lose decade total score.
1174,deep,193,Improve despite door power.
1175,cause,105,Writer spring big increase teach low.
1176,your,21,Difficult admit happy prepare left pressure.
1177,draw,102,Write education evening dark expert.
1178,six,193,Enough color set discover ago discussion.
1179,item,83,Use source recent three action environmental.
1180,explain,90,Be next hit subject dark these measure.
1181,be,199,Quickly system bill plant.
1182,cultural,111,Point all design court consumer theory strategy.
1183,want,34,Although resource yes respond.
1184,follow,162,Mission analysis include author black easy.
1185,under,34,Let country stock represent each become product.
1186,treat,65,Measure event wish final man election.
1187,final,55,Stage show black beat site.
1188,teach,65,Middle home even number safe.
1189,media,164,Born beautiful hit serious local gun firm.
1190,make,40,Raise ready describe force our.
1191,way,200,Image body few suffer.
1192,national,173,New race nation practice probably.
1193,which,194,Station cell what writer.
1194,deal,43,Speak or note several phone.
1195,itself,109,Guy ok you whole enter.
1196,month,135,Exist recognize easy magazine.
1197,stay,196,Situation table nor charge leader benefit nature.
1198,everyone,23,Win crime goal yet perhaps generation.
1199,same,188,Stop look agent. Newspaper face bag even.
1200,firm,114,Head point window agree bar.
1201,thousand,17,Effort prove institution almost.
1202,pay,75,Across home concern action politics ahead mother.
1203,visit,95,Town street key seat budget.
1204,name,152,Any safe discussion free heavy.
1205,trade,162,Husband amount member provide safe.
1206,receive,63,Common make cut.
1207,just,29,Increase idea expect own.
1208,interview,169,During case interest class effect speech.
1209,two,28,Send machine box cell. Tv Democrat ahead cut.
1210,color,153,Hospital anything my learn and.
1211,light,125,Thought could hit sit.
1212,attention,17,Since federal sort ok. Fine argue strong myself.
1213,simply,90,Movement finally exactly they.
1214,I,191,Hotel various agent.
1215,system,144,Them town ever case section.
1216,believe,24,Bad attention house fast population owner.
1217,task,106,Such environment stand main.
1218,everybody,62,Network will as. Treatment on movement health.
1219,artist,187,Degree view require increase stage break.
1220,question,31,Who body quality grow sign.
1221,himself,88,Test culture develop he list.
1222,would,179,Medical before special look stay change reduce.
1223,arrive,33,Upon campaign level economic. Visit perform ask.
1224,sign,63,Great join without training place.
1225,dark,136,Step community dark system individual.
1226,plant,108,Almost rock bag letter bring morning agreement.
1227,structure,151,Very drug PM girl.
1228,station,161,Deal raise return ready understand.
1229,indicate,149,Many employee big employee above account quality.
1230,assume,98,How help all media five notice onto.
1231,take,112,Now sound administration summer ready.
1232,none,113,Far step different own.
1233,national,101,Focus firm before knowledge likely.
1234,people,128,Realize weight peace interesting drive.
1235,by,85,New exist position later decision cultural sport.
1236,chance,29,Along if worker radio.
1237,reason,126,Eight list manage water end.
1238,most,94,Likely quality activity field upon president.
1239,sense,135,Sit stage me wall campaign herself.
1240,trip,187,Anyone past million push American film garden.
1241,hope,44,Draw stay require wear happy result government.
1242,human,95,Theory mind store establish sometimes.
1243,eat,82,Value as catch according.
1244,adult,171,Bill collection result moment adult scientist.
1245,mean,69,Next Congress different road rather happen.
1246,short,57,Cup eat important miss I add.
1247,few,11,Beat assume and four. Writer only sing.
1248,rather,157,That challenge kind student money agent two.
1249,cup,21,Water believe television.
1250,candidate,104,Somebody side general month leader class.
1251,environmental,192,Kid keep rule. Minute hear recent north.
1252,claim,119,Five three indeed term assume administration.
1253,tend,52,Which try show century trip change.
1254,form,75,Continue drug simply she determine feel.
1255,relate,175,Some into certainly rise.
1256,great,142,Happen compare say also beautiful.
1257,receive,19,Manage decide strategy national pressure.
1258,herself,80,Simple risk run series. They wife old.
1259,laugh,27,Animal example picture staff eat.
1260,site,161,Present word build campaign close.
1261,account,43,Water accept receive candidate hand.
1262,leave,86,Think check least give off her push.
1263,discussion,22,Three color free compare. Tough seven stuff lay.
1264,free,49,Degree community control structure walk lot.
1265,next,111,Cold right store else industry happen five.
1266,reach,21,Ever many them fish gun.
1267,teacher,69,Model parent road third.
1268,network,64,Just visit audience do wide job.
1269,nice,128,Election way wind happy. Watch letter unit guess.
1270,body,36,Magazine senior which important growth account.
1271,carry,37,Discussion field sense.
1272,oil,13,Well Mr consumer likely sure itself.
1273,person,101,Sense during trip term teach among notice.
1274,central,165,Back land option management. See eye produce.
1275,first,91,Still girl yes door.
1276,someone,133,Evening consider article newspaper season man.
1277,opportunity,122,Kitchen statement leave dog send.
1278,wife,169,Memory benefit do start risk why establish.
1279,tend,134,Available serious consider.
1280,pick,156,Surface if then two center PM change.
1281,help,192,Morning out western employee himself.
1282,direction,118,Imagine situation suffer right.
1283,character,109,Law hit money bank enter kitchen.
1284,control,161,Artist material even open authority type very.
1285,manage,59,Management knowledge short adult.
1286,list,76,Dream move home public sometimes.
1287,decade,179,Range most speak.
1288,product,15,News feel family relationship.
1289,less,48,Rather develop party child chance.
1290,claim,92,Meeting goal of without. Soon focus once lead.
1291,run,40,Issue population production area.
1292,peace,90,Memory public long. So dinner simple.
1293,activity,117,Country event camera morning travel.
1294,media,25,Save agency want address develop.
1295,entire,149,Official practice oil responsibility.
1296,thought,124,Alone meeting herself pick fill.
1297,available,105,From standard explain affect agent glass.
1298,a,167,Give mean weight other.
1299,number,98,Student relate exactly whom.
1300,camera,43,Security Mrs character financial school.
1301,state,78,Own star star whole realize here race.
1302,reveal,197,All table than fly form.
1303,buy,199,How read wall blood buy take.
1304,sport,148,What eight necessary. Can though side deep.
1305,necessary,42,Boy group model however imagine recently.
1306,rich,41,Suddenly attorney pretty along worker more.
1307,into,141,Brother house standard beyond good.
1308,be,90,Week company else network new court ahead.
1309,order,135,Quickly western interest.
1310,life,141,Production almost employee total easy believe.
1311,poor,74,Single well fund up clearly career.
1312,lawyer,17,Camera case since.
1313,partner,109,Chance appear project.
1314,discuss,33,Financial nature pressure look compare story.
1315,thus,161,Easy see here school though owner.
1316,pass,22,Foot upon hot air so.
1317,my,108,Meeting forward put difference court population.
1318,as,106,Glass argue ahead any somebody serve camera sit.
1319,forward,185,Wall contain your article into.
1320,yard,144,Indicate lay crime our.
1321,strategy,67,Smile audience wait eat.
1322,miss,77,View international manager lay.
1323,including,82,Home marriage job court business present.
1324,true,96,Central arm case kind travel.
1325,discuss,36,Box anything huge middle.
1326,page,117,Soon enter seem mission natural everybody.
1327,thing,152,Middle commercial maybe quality this specific.
1328,use,27,Religious send run sure.
1329,rate,127,Church memory reflect well consumer necessary.
1330,stuff,67,Language environmental heavy head drug.
1331,president,86,Culture world yet behind event.
1332,environmental,84,Want network image. Movie stuff culture allow.
1333,through,191,Final receive news how try turn operation.
1334,main,132,Nice hope family pretty election experience.
1335,company,145,Long range statement reveal quality.
1336,miss,186,Cover keep finish bag sometimes deal itself.
1337,way,193,Event wonder morning information article.
1338,her,117,Between capital cause voice sit different.
1339,you,47,Team concern quickly far traditional.
1340,yard,131,Same compare TV more ever above question.
1341,stay,197,Able book since subject analysis person position.
1342,write,114,Explain beautiful herself get.
1343,although,188,Statement whose myself tell.
1344,radio,134,Minute from itself tree senior simply before.
1345,either,49,Become mouth middle foreign.
1346,trial,199,Approach court fine eight.
1347,show,25,Yourself young sort likely while but.
1348,check,131,Skin remember yard new example business.
1349,minute,45,Crime often likely environment.
1350,act,38,All recent hand establish professor sure perform.
1351,recognize,158,Home church rest that.
1352,weight,196,Ten TV game there main.
1353,range,28,Adult far or learn way.
1354,red,145,Economic attack must buy them treatment.
1355,herself,99,Responsibility actually success face ahead.
1356,become,137,Call represent statement pass around.
1357,you,200,Wait prepare avoid write.
1358,fast,158,Pm point not else activity.
1359,friend,84,Star officer risk traditional.
1360,four,141,Red right exist movement mission street bed.
1361,want,25,End difference information least.
1362,provide,66,Admit clearly model certain.
1363,main,183,Debate evidence among actually.
1364,attack,43,Article strong arm rather.
1365,get,54,As occur star article.
1366,call,87,Certain piece manager case spring soon.
1367,commercial,32,Threat last size imagine material nice doctor.
1368,they,49,Game sister this letter.
1369,respond,117,Family spend carry raise however.
1370,debate,36,Particularly win popular oil light.
1371,alone,111,Lose present research performance.
1372,note,157,Specific hospital risk style chance.
1373,everyone,188,Service we would many commercial bit.
1374,because,66,Design war evening different serious.
1375,understand,66,State government act my indicate view.
1376,add,136,Keep yard choice sort statement your.
1377,some,59,Without need region medical already better movie.
1378,represent,122,Hospital also reality until various sign nearly.
1379,wrong,62,Ready service upon gas challenge.
1380,show,160,Which prove sure administration television until.
1381,manage,58,Talk action build we with.
1382,skin,125,Walk station over each loss through.
1383,every,13,Next because position way personal there.
1384,lay,169,Question seem me arrive work no have.
1385,deep,196,Benefit town north seven know.
1386,second,173,House threat miss voice president sea color none.
1387,even,169,Will media family left energy entire.
1388,by,155,About possible ask need.
1389,write,41,Them laugh character perform number serious.
1390,put,15,Eat nature walk put right receive.
1391,least,112,Plant military successful vote evidence billion.
1392,democratic,133,Pick true try from crime floor.
1393,brother,65,Find remain may onto.
1394,ten,78,Describe first writer agent.
1395,myself,42,Give certainly tell or leader.
1396,buy,117,Point media culture carry how begin truth.
1397,leader,85,Hundred oil character technology.
1398,couple,197,Happy ten role eight beat consider.
1399,identify,90,Business could among like tell.
1400,page,170,Newspaper industry list really big bring how.
1401,different,111,Her my smile no produce.
1402,decide,12,Approach never instead store success lead.
1403,according,140,Agreement fly again itself.
1404,could,174,Send fire remember one next into stuff his.
1405,prevent,129,Especially good seek along military hair.
1406,test,26,Government trip amount red main out hit.
1407,tax,122,Pass former already small thing hard.
1408,memory,182,Standard dinner case always degree finish walk.
1409,happy,118,Player support nearly TV leader pretty.
1410,education,10,Between some water recently. Safe agency require.
1411,hear,148,Student man station region war opportunity floor.
1412,among,154,Management suggest rate including discuss.
1413,ever,164,So blue middle question cut as.
1414,speech,92,Must instead form feel. Herself foot Mrs skill.
1415,garden,128,Add seven health somebody attorney.
1416,how,74,Maybe cultural teacher feeling describe thing.
1417,note,115,Picture unit read already.
1418,claim,134,On not four month authority girl.
1419,cup,105,Detail both budget down myself speak enter term.
1420,smile,43,Actually seven always.
1421,coach,144,Knowledge describe I.
1422,blue,132,White size for fight through give staff.
1423,number,149,Cell late north. Water state drug budget answer.
1424,later,19,Story political usually individual.
1425,read,11,Together hundred ground husband.
1426,order,157,Cold debate population candidate member.
1427,minute,169,Challenge per fine view all move.
1428,thus,97,Mouth white young his rich.
1429,those,22,Southern major join yard interest.
1430,six,42,Media fast product job authority bring.
1431,carry,193,Second technology weight response friend free.
1432,note,198,Minute fight lose road person least.
1433,quality,50,Take story suggest thought even.
1434,animal,162,Learn involve add near food but.
1435,development,199,Order top for language debate magazine rate.
1436,either,147,Miss late line stage probably season hear case.
1437,describe,159,Up consumer least walk manager.
1438,always,190,Cost artist material federal stop.
1439,research,54,Raise live hard fire himself laugh.
1440,church,27,Spend create another program put dog nearly.
1441,parent,147,She game view brother feeling. Let rule per four.
1442,save,192,Plant right school by rise act production.
1443,next,37,Economic know these nice call card PM range.
1444,commercial,197,Film hand cell risk you cut boy.
1445,bad,113,Air its ago concern. Compare top often.
1446,town,82,Cover onto century personal still.
1447,pattern,142,Line especially record without us water.
1448,study,125,Theory position us run west its.
1449,down,38,Case peace number eight policy good.
1450,tree,126,Build pass choose matter art meet.
1451,should,178,Budget dinner town wish strong phone.
1452,customer,20,Conference ground agree president.
1453,exactly,92,Attack opportunity difference discover.
1454,meeting,85,Especially radio continue trade human by.
1455,explain,163,Involve ask someone fly whose case.
1456,lose,174,Special cup rate.
1457,well,80,Possible put image war happen myself.
1458,avoid,184,Herself treatment entire decade shoulder.
1459,dream,54,Cause wait work step but pick election.
1460,hundred,98,Painting first pay key.
1461,who,15,Pattern short activity gun year exist.
1462,forget,189,Thus candidate arm attorney themselves not.
1463,physical,78,South its forward bit term want.
1464,try,13,Nation young who their movement then.
1465,difficult,109,Decision human put safe use.
1466,national,53,Interview process interview director everyone.
1467,plant,49,Plan social factor myself through food along.
1468,put,125,Bit staff white. Action word minute spend offer.
1469,agency,106,Laugh audience consumer security.
1470,radio,54,Save role deep from real.
1471,future,145,Training window official also.
1472,special,172,Smile edge here approach term certainly.
1473,year,87,Similar effect morning hear.
1474,new,168,Still big language senior anything talk dark.
1475,rate,82,Cultural east rock resource picture raise black.
1476,as,86,Approach less concern risk.
1477,national,200,However chance politics will.
1478,special,128,Rate international little address.
1479,specific,158,Wait money size power part collection clear.
1480,on,14,Particular mission kid could.
1481,part,99,Food certainly bill stop material.
1482,individual,193,Image structure baby their table career charge.
1483,behind,196,Pretty than traditional fill billion member.
1484,let,186,Within former include nearly address.
1485,Democrat,23,Administration ball firm.
1486,case,142,Campaign raise through city keep house.
1487,peace,35,World make first simple eat.
1488,summer,52,Weight test every front. Truth middle more good.
1489,popular,48,Car subject hundred will drug analysis national.
1490,situation,121,Attorney morning return two how wear.
1491,school,146,Figure training director want think simple.
1492,city,20,Individual author make loss.
1493,south,58,Up community week the do book.
1494,it,134,Itself within wall stuff. Require site level red.
1495,yard,100,Great it author image recently floor.
1496,dark,93,Because sell really million.
1497,should,76,Party baby there discussion language main order.
1498,whether,103,Son leg Congress six. Deal small rest reach play.
1499,dark,57,Agent analysis resource rest until process.
1500,newspaper,185,Method top over ground.
1501,understand,76,Amount size agency leader around cover my.
1502,size,174,Environment first a pressure certain very big.
1503,physical,148,End not kind country note.
1504,want,193,Evidence ever about according team fine.
1505,use,180,But space Republican race without there fish.
1506,citizen,54,Fast support tonight population.
1507,get,93,Whom buy traditional every maybe she six.
1508,ask,181,Huge movie time risk glass beyond.
1509,contain,23,Drop compare sign song authority risk.
1510,answer,141,Challenge under expert contain ago black.
1511,have,84,Structure whatever strategy deal movement only.
1512,book,14,College several safe mean trade.
1513,rock,21,Executive less sure use.
1514,customer,155,Area most stay south inside minute.
1515,structure,76,Same available across.
1516,brother,22,Note clearly something source environmental.
1517,note,177,Media life spend expert city lead student.
1518,campaign,63,Cell less style career enter.
1519,ready,61,Official throw law land thought however water.
1520,movement,131,Better case discuss top board treatment.
1521,father,58,Challenge day purpose.
1522,child,192,Across shake source.
1523,hit,79,Reveal project compare picture southern.
1524,until,197,Unit lot the hard stand send reflect.
1525,role,43,Our about analysis.
1526,including,11,Hand top movie program glass under.
1527,education,161,Everyone they happy just fly life.
1528,scene,185,Pattern growth hold.
1529,hundred,134,Significant those world tonight candidate step.
1530,hotel,48,Difference type ask face image compare resource.
1531,drug,56,I nor tax international meet tonight.
1532,image,21,Thousand school become person investment.
1533,him,200,Church something ago may career white ten.
1534,ahead,189,Structure move visit sort sort seek eye.
1535,point,74,Popular that little room rise.
1536,ground,17,Peace common within big look lay would.
1537,church,182,Amount describe suddenly land remain score.
1538,admit,55,Red right pay avoid buy.
1539,religious,21,High two success say industry manage nor wish.
1540,toward,72,Me piece simple bill southern.
1541,power,24,Camera run accept skin.
