id,nombre,costo,descripcion
1,class,14,Exactly as black sing.
2,contain,171,Cover ago take.
3,speak,192,Level factor appear sit.
4,personal,11,Political country speech military.
5,even,196,Soldier sport deep simple allow.
6,body,135,View student theory. Girl enjoy above pattern.
7,nearly,35,Help market number heart these serious different.
8,keep,62,Company bit security raise.
9,reveal,179,Of situation forward.
10,sing,106,Account successful enjoy market.
11,laugh,192,Recent yard dream couple participant.
12,hundred,61,Position pressure particular dinner.
13,more,160,Discussion deal show even sit similar.
14,down,28,Page beat finally season seek reflect.
15,short,24,Official stop energy where recent suddenly.
16,late,84,Deal beyond degree his guy matter herself get.
17,sense,102,Ability money manager how policy.
18,rather,67,Watch hope ready if myself continue subject.
19,heart,23,Throughout article single.
20,statement,154,During already science several law sister.
21,among,156,Power both one ask inside. Past usually company.
22,make,94,Democrat stop themselves big.
23,machine,163,Someone enjoy fall water when.
24,from,136,Help economic hundred board month present.
25,price,159,Always prevent recently others.
26,however,73,Strategy itself too agreement would tax.
27,model,155,Memory happy military boy.
28,short,89,Audience you since another. Leg agent group but.
29,cause,102,Population white store.
30,mother,56,Walk traditional century data start then.
31,later,41,Where technology finish test include place.
32,season,122,Half process environment go community throughout.
33,another,139,He season leave phone sit.
34,occur,45,Go test traditional city market.
35,him,74,List discover according us environment color.
36,idea,60,Thus door the company past evening.
37,source,175,Explain impact by type.
38,we,79,Tv for who before nearly machine clear impact.
39,account,66,Study others community American nearly tree turn.
40,another,96,Build total activity how.
41,way,23,Statement partner mean choose general wish.
42,will,138,Specific east avoid staff central race.
43,garden,142,Artist suddenly play green recently.
44,reveal,12,Energy someone fear either actually.
45,system,115,Foreign nearly age.
46,stage,137,Eight foot table expert yard.
47,head,75,A expect whose skill game.
48,one,101,Responsibility nice home certainly pressure than.
49,money,156,Himself treatment beat idea class.
50,among,42,Answer material address tend.
51,draw,15,Today member nor peace act summer structure.
52,move,86,Certainly rock cause fund its hundred.
53,space,86,Store third pretty start.
54,store,120,Education agreement shoulder economy sometimes.
55,act,160,No nation citizen.
56,compare,172,Wish wait study I majority avoid brother.
57,bring,126,Toward model concern one crime.
58,authority,156,Cell design whatever may wall.
59,choose,176,About education much yet condition person who.
60,she,13,Public between treat trade tree end.
61,young,97,Room list word a than street fast.
62,how,81,Simply go near weight.
63,individual,27,Everyone player price.
64,lead,124,Sit painting like us hope.
65,machine,159,Oil population threat.
66,prepare,26,Individual yard most free.
67,manager,162,Until cause much stuff teacher.
68,debate,162,Tree scientist could. Dark conference bed bad.
69,physical,62,Might however matter represent.
70,meeting,86,Need identify range difficult head according.
71,continue,21,Together theory writer soldier.
72,his,64,Mouth get vote student firm.
73,already,192,Central road customer son husband.
74,stage,87,Discover everything reflect friend should big.
75,author,18,Pick music life leg true long must.
76,recent,31,Away certain hard trouble college western.
77,think,37,Make mother international fight vote.
78,series,99,Let push affect two instead.
79,authority,20,Pass though how after.
80,although,117,Source expert media try ever learn seek seem.
81,forget,121,Yeah security nature building however.
82,book,174,Stand shake man. Compare sound five man body.
83,every,197,Discuss be again argue smile easy resource.
84,need,147,School station even support paper talk second.
85,drug,180,Whose care white. Social find consider at wrong.
86,arm,46,Shoulder state different consumer tax.
87,last,57,Teach successful history.
88,because,28,Push to bank get represent government usually.
89,program,63,Government involve pull himself operation than.
90,at,31,Pretty safe somebody risk material.
91,simply,142,Speak beyond stop Congress political even.
92,black,73,Project around region floor animal.
93,around,97,Itself him control foot. Bad suggest school.
94,cup,52,Write quite when rather.
95,everybody,112,Same water anyone goal son.
96,economy,50,Bag gun organization girl focus few.
97,now,15,Industry onto physical away.
98,at,187,Sister all around sign nation billion.
99,life,62,Rock follow might without partner pick.
100,reduce,196,Material improve also late yes side far consumer.
101,ten,147,Mouth quite fear likely.
102,play,64,Skin doctor unit process degree think.
103,star,28,Recognize question join experience side.
104,seven,93,Common foot itself side clearly while high close.
105,goal,179,Mind not laugh want goal question.
106,star,23,Dog beautiful indicate seek.
107,behavior,29,Use avoid significant.
108,box,76,Support over bring onto.
109,along,143,Walk everything deep dark.
110,lose,61,Real each take six sea home worry.
111,knowledge,128,Hair race report line.
112,yard,27,Accept offer tree perhaps impact born church.
113,wind,84,Best fact attention south let front.
114,expect,159,Necessary list prepare response drop attention.
115,open,33,Pretty notice tax box second want.
116,owner,86,Student improve pick food military degree walk.
117,recently,42,Expect simply face piece away.
118,leg,17,Something unit represent difference turn.
119,four,99,Someone within choose act education use.
120,add,177,Not wonder maybe conference make.
121,raise,132,Real attack cultural nation evening service.
122,among,52,Check ok plant hotel account walk avoid.
123,person,34,Blood drive success yeah vote action.
124,table,139,Recent next opportunity wall recently.
125,score,148,Reveal provide minute pay.
126,see,169,Whose almost boy join performance note too main.
127,power,129,Discuss age gun control pull lay.
128,past,87,Career opportunity sort third reach.
129,inside,114,Southern look claim. Country exist others hear.
130,where,14,Game son southern lot.
131,tax,139,To popular technology support want mission.
132,word,157,Stock large speak forward expect.
133,check,90,Rather magazine human very.
134,over,186,Animal daughter process executive large your.
135,yourself,165,Sure economy avoid industry seek rate.
136,candidate,54,Else consider economic ask fill.
137,lay,98,What college discover imagine worry model.
138,himself,62,Hotel in ago book life. Gun few art relate size.
139,always,162,Believe attorney happen industry.
140,training,114,I better human power girl building message.
141,effect,169,Think down it tell couple.
142,director,101,Doctor toward prepare develop opportunity plan.
143,risk,110,Technology second whatever.
144,sense,93,Sometimes cold we ask seek hard any.
145,right,115,Tonight will we occur community.
146,well,39,Apply enough suffer or east pretty by.
147,design,42,He want product expect.
148,unit,48,Only ago thing certain resource seem ability.
149,after,118,Certain building often hear father arm world.
150,usually,84,Garden somebody the state eye become.
151,score,42,Per game up his.
152,executive,24,Understand outside model cost.
153,could,46,Which large base whatever education.
154,above,153,Wonder nor natural several why.
155,only,31,Them inside rise in.
156,visit,153,Appear minute indicate she arm.
157,any,137,Land bad nearly. Vote clearly Mrs continue.
158,mention,189,Top seek how plant feel.
159,computer,190,Know above protect week.
160,recent,144,Response east participant analysis.
161,himself,35,Behind institution painting question seat.
162,under,110,Order opportunity can treat discuss throughout.
163,ground,163,Available through social indeed region.
164,friend,54,Join gun fact simply adult risk manager.
165,well,144,Wear social run forget.
166,letter,57,Try ever professor will yard reveal affect.
167,own,42,Answer form thank test notice.
168,language,63,Light education Mr south.
169,relate,126,Information deep career single smile car.
170,help,166,Everyone continue authority.
171,task,50,How able better similar.
172,return,174,Stuff power face view.
173,music,97,Per mother weight campaign.
174,find,47,Front challenge recent around stuff bad.
175,school,194,Energy its fall foreign either study every.
176,represent,57,Especially lose behind stay yet evening society.
177,letter,178,Ability with production hope.
178,also,48,Hair drive simply me. Color well bag couple add.
179,accept,14,Miss actually need worry herself.
180,significant,10,Personal action three wrong.
181,range,19,Traditional growth outside chance.
182,often,186,People candidate leader adult product.
183,line,187,Source themselves now morning former.
184,artist,190,Reason buy provide area although.
185,reveal,38,Beat box feeling.
186,step,104,Term community force picture thought late couple.
187,information,45,Speech church minute performance entire address.
188,fly,172,Including improve or phone catch.
189,out,20,Fish five far write hand sea.
190,treat,117,Admit gun Republican instead name give.
191,vote,20,Memory fact sit trouble.
192,debate,187,Attention expert sometimes general way despite.
193,learn,147,Claim leader entire five cause give.
194,growth,173,Side decade time language buy performance.
195,policy,189,Analysis space strategy sign third.
196,air,47,Support car else. Occur hot management mouth.
197,follow,22,Many law matter stock.
198,camera,61,Worker no lead present while mean.
199,my,19,Remember send tell apply ask.
200,special,109,Me yet manage political.
201,situation,179,Personal low Democrat.
202,which,90,Interesting grow sometimes risk.
203,article,101,Reduce ball military economy under mouth.
204,according,192,Daughter figure give kind take decision.
205,music,33,Only today idea suggest gun number recently.
206,walk,61,Government stand can those he.
207,bill,72,Popular agent dark leg discover hair.
208,suffer,33,Positive organization many see.
209,activity,106,Civil respond least every edge blue.
210,lot,103,Reality light floor serve nothing daughter.
211,region,100,Though PM with must local point trouble.
212,mention,106,Social well worker last huge eye.
213,family,40,Goal ready standard picture difficult.
214,continue,176,Try free nearly house member.
215,take,187,Lay project military successful kid side.
216,owner,188,Have single thing ready control admit.
217,drop,195,Turn care life this.
218,central,20,Bank moment trial general issue eye head.
219,hair,73,Reveal official day.
220,resource,70,Clear message agreement evidence.
221,cause,89,Life help instead decision subject our prove.
222,keep,66,Mother camera truth once friend.
223,commercial,123,Tonight far without education.
224,behind,85,Lay up their white.
225,walk,105,Dog force continue suffer.
226,kid,121,Wait idea heart north nor key prevent.
227,radio,110,Money explain be southern nice.
228,order,147,Drug apply opportunity religious.
229,measure,197,Especially price two address cause leave.
230,different,86,Young decade first listen number.
231,likely,172,Thank born less measure detail.
232,down,124,Stay fall talk study power.
233,seek,123,Kind dog camera somebody.
234,table,35,Hit science threat safe although.
235,science,102,Song here later card base conference.
236,available,33,Tree present relationship it.
237,herself,59,Scene spring special enter floor where.
238,purpose,181,Indicate return year hope.
239,understand,60,After child subject alone federal Congress.
240,less,195,Line history natural. So list space dream many.
241,mission,148,Serious quickly just since more drive.
242,season,50,Her other rest true perform enjoy cause.
243,measure,71,Little my seat result candidate.
244,on,117,Determine early develop senior phone by spend.
245,grow,144,Avoid nation too family.
246,major,118,Medical half now here.
247,history,39,Everything Republican lead bar manager.
248,money,25,View special century thank consumer.
249,experience,121,Wide exactly American century evidence body red.
250,operation,26,Five write recognize.
251,stand,14,Series full play board.
252,fire,59,Center say put represent economy.
253,business,43,None expect put interview become be effect they.
254,seat,98,Series throughout kind draw bank plant will.
255,story,111,Lay reality decade foreign.
256,show,165,Day sense left leader opportunity.
257,avoid,131,Loss never state few follow station tonight.
258,gas,45,Part behind become campaign.
259,church,110,None need defense black.
260,window,44,Democrat challenge yet operation put.
261,position,124,Everything smile him door you allow recently old.
262,Mrs,57,Nothing Congress sometimes eight he.
263,know,32,Long great nation if suggest.
264,stock,184,Suddenly left floor behavior light meet.
265,store,161,Time red realize.
266,improve,144,Family team result sister star.
267,Mr,111,Air staff including much only moment guy person.
268,remember,137,Over fact by begin. Understand simple always old.
269,ball,49,Election market travel above act evening.
270,interesting,79,Order best cold picture.
271,step,189,Poor hold focus include behind rise.
272,agency,157,Population west factor.
273,if,118,Car let by least another management.
274,throw,25,Act run perhaps rock final job job oil.
275,organization,188,Interview art within decide agency person sit.
276,election,11,Note finish most white. Card kid see body.
277,according,36,Interview turn after speech.
278,enough,139,See trial imagine cover ahead industry.
279,girl,28,Authority perform white.
280,middle,71,Its someone low order.
281,especially,82,Drug necessary sport gun role effect radio.
282,region,42,Concern suddenly morning worry star.
283,pay,149,Pretty miss lay she before.
284,end,34,Possible table third leg loss large unit clearly.
285,someone,180,Later some democratic until result including.
286,economy,160,Pay perform painting appear.
287,lot,23,Student administration institution.
288,writer,194,Enjoy responsibility response.
289,education,116,Catch nearly dinner do.
290,guy,70,Figure idea enough.
291,assume,64,Stuff conference sit culture.
292,billion,129,Thousand prevent accept include apply value.
293,carry,176,Individual his room dark. Wish air its sometimes.
294,development,178,Media anyone article responsibility.
295,me,93,Ten hundred policy former even mouth together.
296,reach,75,Number pay me but off recent our.
297,run,66,Consumer newspaper them reach music by five.
298,other,166,Rate pull our senior.
299,sit,113,Somebody life ball itself call.
300,air,144,Wear card mention.
301,record,110,Policy down at challenge.
302,room,70,Set citizen site collection gas. Trial state sea.
303,per,127,Commercial enter stock physical avoid my blood.
304,dream,122,Be situation anyone hear listen range wonder.
305,sort,189,Answer later choice doctor behind.
306,them,30,Certain everything usually affect least.
307,fish,175,Receive act with per event TV.
308,share,168,Fly stuff election free fact statement agreement.
309,center,142,Bring half while lose.
310,above,70,All good run claim leave cultural.
311,risk,65,First lose situation class.
312,collection,200,West nor computer out.
313,ever,59,Affect life before.
314,one,104,Again lawyer soon either thousand full watch.
315,size,98,Stage total major both baby.
316,natural,25,Heavy evening bring size.
317,instead,87,Respond test church person culture today set.
318,member,108,We should them movement something.
319,game,180,Wait hear store student decide type live.
320,protect,43,On tell argue exist.
321,huge,31,Series relate thank may type oil other.
322,until,174,Away agreement stage piece.
323,beautiful,130,Nothing hand evidence camera land.
324,society,119,Site old today Mrs.
325,example,83,Indeed these letter us.
326,nation,31,Market pull little rise. History travel light.
327,owner,145,Success fly five sister.
328,century,69,Anyone race food a.
329,affect,87,Around age movement north major sit rather list.
330,provide,55,Exactly stock throw newspaper rock.
331,task,60,Surface throughout participant company.
332,realize,81,Form capital physical already.
333,international,122,Where card fund writer picture such.
334,family,101,Finish education score test themselves.
335,total,165,Kitchen test financial suffer.
336,Democrat,155,Standard force anyone see.
337,pull,114,Test election nearly movement beat shoulder.
338,now,128,Let oil never firm model evidence. Team put bank.
339,southern,59,Inside think three general.
340,again,133,Second simple enter true avoid Congress.
341,compare,105,Along with down rest mean base well.
342,him,195,Man decision just evidence outside laugh.
343,all,82,Pay art guy wife note usually learn.
344,cover,42,Value true seek strong near behavior.
345,another,56,Benefit trade just end adult particularly.
346,owner,195,Control fund particular blue staff.
347,claim,139,Until floor a develop decision expect.
348,despite,116,Return ten tax before take risk his.
349,way,187,Hair fast could consider.
350,themselves,153,Past draw travel home western interview.
351,idea,73,Others support left during line listen.
352,indeed,21,Left entire together. Against commercial doctor.
353,serve,181,Senior it key talk fact.
354,would,14,Certain force little fall hard.
355,occur,30,Glass rate participant lead area town.
356,view,145,Let box clearly prove option cover perhaps.
357,charge,128,Adult good goal because mission office take.
358,suffer,86,Especially level debate head.
359,not,91,Message pretty treatment Mr security.
360,raise,111,Question poor us white church strategy.
361,week,190,Low situation guess mind adult form.
362,reveal,184,Member group identify career west particularly.
363,between,189,Bank plan may sing establish.
364,parent,180,Newspaper trade behavior realize politics.
365,question,105,Girl two time easy half.
366,party,153,Property where live they.
367,determine,85,Hospital person class weight this stock.
368,front,178,Scene child force fall treatment show.
369,pay,110,Decide soon decide range.
370,fund,136,White south piece water nearly sense.
371,kitchen,162,Finish either if nature least explain common.
372,from,86,More task threat pay growth speak test.
373,unit,31,Campaign various join note.
374,cell,67,Away people rule to.
375,fly,169,Least face few deal.
376,talk,64,Impact idea hotel.
377,everybody,124,Could yet discuss develop lead ready hospital.
378,page,116,Popular interview seem game often ahead.
379,save,170,Others write mean beyond your drop.
380,garden,69,Have fly opportunity minute.
381,indicate,146,Call she right painting.
382,whom,119,Strategy trial well experience practice enough.
383,group,113,Source watch tough there lay local.
384,join,172,Boy quite adult federal reflect spring.
385,reach,125,Senior take choose available.
386,with,78,Decision offer no large.
387,face,164,Some moment far American baby read degree.
388,will,40,Note security eight happen easy spring nature.
389,just,175,Behind mission fact.
390,available,152,Should TV fund dark clearly.
391,make,126,It but authority feel actually.
392,black,183,Raise firm light still protect piece.
393,learn,161,Exist certain interesting subject style agent.
394,draw,105,Environment mind develop play.
395,parent,145,Maybe travel area foot want marriage.
396,national,156,Whatever education recently less.
397,community,47,Fact charge their above.
398,ready,169,Business time avoid most white drop.
399,man,128,Company event performance add.
400,day,47,Likely series stage let. Network real between.
401,allow,151,Indicate current drop significant report.
402,site,171,Better might common nor.
403,kid,170,Past offer door candidate thing goal discover up.
404,serve,192,Wall account message.
405,girl,64,Rather save Mr guy occur accept test.
406,cut,181,Away identify sure describe.
407,street,63,Outside economy TV sing.
408,recent,48,Tough of whose whose meet behavior collection.
409,ago,196,Music north thousand wish hand.
410,standard,134,Same late movement win contain bank.
411,different,24,Over explain baby. Charge security wonder form.
412,middle,51,Win southern soon.
413,dream,101,Spend take sense word quality record.
414,night,22,Reality future let direction.
415,probably,100,Cover discussion almost high.
416,knowledge,127,Happy civil senior also tough huge.
417,answer,104,Then born for. Technology month huge.
418,remember,191,Interest study son condition.
419,participant,200,Group center effect evening message.
420,piece,97,Yes five stay mouth boy.
421,movement,46,Pay age seat commercial wall.
422,chair,107,Field key scene center my she around reason.
423,ever,154,Official safe throughout reflect.
424,agree,118,Collection every part then check.
425,impact,115,His those future house color.
426,machine,173,Series fill garden show able do.
427,region,73,East future major son law bag thing.
428,election,19,Matter product two.
429,create,105,Growth hospital move large.
430,increase,40,Respond not community know enjoy.
431,per,172,Resource there under.
432,impact,54,Paper think price account truth.
433,senior,65,Opportunity try foot.
434,prepare,99,Stop front daughter product his image.
435,development,60,Here oil recognize enter. Tell increase need eye.
436,something,26,Reduce whole certainly cover avoid upon purpose.
437,group,14,Quality major investment president.
438,second,61,Street you member message individual run.
439,answer,160,Not discover information want spring.
440,manage,32,Color the section party.
441,read,76,Policy floor and hand field director.
442,such,139,House today from cup rate business.
443,space,151,None food adult area audience condition.
444,product,69,Go security offer always this possible.
445,line,69,Room stock sometimes we body week top.
446,cost,105,Pass strategy thank Mr agree.
447,help,142,Evening in sign yeah deep participant black.
448,goal,138,Fall leg career million party game goal likely.
449,only,94,White church glass mean.
450,beat,90,Town during top hold claim ready first.
451,within,95,Tell plant system out threat case.
452,able,181,Rest its history often stay along lead.
453,type,112,Use tough common in.
454,recently,120,Reveal drive arm agreement benefit side can.
455,capital,183,Part moment teach behavior toward sport lead.
456,mean,86,Price address often hundred word beyond.
457,tax,50,Loss remain lead sense main everything.
458,almost,165,Cold let begin. Return side can everybody chance.
459,range,87,Remember car radio. Month deep add move piece.
460,key,134,Newspaper audience old win somebody animal down.
461,stuff,88,Hold hundred firm until technology benefit small.
462,measure,147,Happy this yet meeting else piece read.
463,result,193,South rest soon itself different soon amount.
464,serve,134,Charge wonder school five appear use.
465,campaign,145,Over body political check information up out.
466,keep,32,Go prove back huge deep those.
467,give,97,Front for office indicate senior wish.
468,movement,95,Act work coach respond ten physical.
469,behind,80,Whatever partner edge cover size body push.
470,feel,125,Identify cost this various store.
471,possible,58,North threat agent girl explain central.
472,five,16,Before left executive.
473,data,43,Never how rest pass build interesting.
474,will,23,Chance suddenly training.
475,alone,130,Moment that necessary prepare.
476,next,152,Its ten require pressure of.
477,certain,96,Role inside sister recent reason.
478,option,141,Western so investment.
479,line,118,American behind visit policy under sense gun.
480,suddenly,71,Drive sport yet animal cut during indeed.
481,trip,128,Into seven build.
482,son,149,Past past skin see.
483,need,172,While wish question live develop professor.
484,information,102,Century notice break win charge place.
485,people,188,Control take push radio.
486,attention,69,Administration test explain thing human bag.
487,summer,192,Third technology major pretty gun game necessary.
488,home,148,Wind shoulder skin involve focus.
489,animal,39,Social reality sense news.
490,want,168,Everything image up various.
491,should,158,South left camera before.
492,possible,173,Word can security minute civil commercial.
493,rule,197,Although glass see would. Move kid low.
494,avoid,156,Newspaper nor alone him stock order agent.
495,authority,125,Pattern against Mr nice raise fire.
496,along,72,Brother trial notice organization he business.
497,behind,26,Sometimes know machine play red water.
498,itself,166,Building include assume.
499,road,155,Inside success area at poor nearly term.
500,wind,78,Bit different give structure happy myself.
501,people,113,Ahead particularly pressure anything.
502,sea,104,Political along which wrong.
503,section,27,None pick almost society city brother weight.
504,clear,15,Trouble feeling speak idea suggest.
505,hospital,77,Worry move capital off base.
506,increase,164,That four over.
507,society,45,President meeting whatever hear beat whom figure.
508,moment,196,Mrs ok white drop.
509,owner,110,Drug interest leader say. Individual wife she.
510,popular,125,Security care perhaps discuss deal.
511,probably,88,Heart few wind military southern attack.
512,similar,154,Arm rise one concern bring everybody.
513,east,166,Off fast hour forward glass social author.
514,purpose,132,Direction attorney miss get finally husband.
515,rich,121,Chance memory task short billion series laugh.
516,add,191,Style relationship case notice.
517,wear,44,Site matter yard coach player race project.
518,white,136,Success during politics would.
519,if,187,Lawyer memory method.
520,agreement,189,Data civil forget we.
521,entire,16,Admit although audience argue.
522,to,185,Visit budget or his modern lawyer.
523,four,197,Time under quality staff old rock administration.
