id,nombre,costo,descripcion
2044,open,105,Institution but a country share phone common.
2045,thought,187,Would degree look even. Event health bring.
2046,big,121,Wear tax bank air.
2047,artist,167,Step exist economic low.
2048,matter,198,Pull possible health.
2049,you,198,Appear instead song better may.
2050,spring,29,Ability set leg find data.
2051,recent,39,Degree paper air standard onto rather state.
2052,decide,148,Fill class office practice.
2053,size,31,Perform feeling my big health also enjoy stop.
2054,nice,85,Couple avoid simple medical soldier.
2055,free,62,Maintain war rest book.
2056,various,149,Rate good sing single history step type.
2057,raise,121,Economic star billion instead.
2058,pass,101,Job well a hear.
2059,entire,44,Explain economy fight certainly to.
2060,road,184,Especially what front.
2061,participant,168,Sing everyone happen necessary.
2062,describe,126,Sell almost along popular. Wrong make rock.
2063,message,84,Kid back various choice cup decade.
2064,enter,168,Crime indeed teacher effort next whose list.
2065,participant,21,Democrat bag story few. Story large against free.
2066,fish,196,Wear the try our thousand.
2067,card,97,Off local yeah exactly believe.
2068,admit,84,Music true with idea hear read street.
2069,attack,104,Theory especially decide manage answer process.
2070,indeed,198,Everything mother want benefit.
2071,country,161,Spring begin start.
2072,respond,186,Station everything live central she.
2073,risk,88,Nice director set.
2074,option,126,Yet process modern concern store.
2075,guess,73,Country main no let need strong.
2076,shake,29,Media set discuss edge. Speak fact story page so.
2077,human,139,Month hope above society avoid actually.
2078,cover,144,Authority question food art condition.
2079,the,66,Glass sign sure political rest stay history.
2080,method,61,Reality include clearly hit. Cover see peace or.
2081,vote,36,Reality in approach drive.
2082,avoid,119,Side couple itself night might.
2083,front,52,Medical news tax certainly campaign oil room.
2084,rich,138,Country degree size hard rock assume or.
2085,race,145,Arm until current pressure unit manager.
2086,teacher,193,Live as the second.
2087,last,174,White through shoulder list gun wonder improve.
2088,everybody,87,Paper indicate real environment light son.
2089,main,150,For house from bit laugh dark.
2090,live,29,Kind service plant summer score hot.
2091,figure,140,Class these matter teacher well.
2092,believe,41,Agreement buy because different. Child wish two.
2093,open,16,Opportunity air where nor nothing center.
2094,themselves,36,Thank never image coach life represent.
2095,defense,94,Painting to know able million.
2096,why,55,Southern might year player change face.
2097,can,160,Whole service past million throw ever.
2098,effect,142,Protect item citizen role.
2099,team,91,Shake treat million agree mouth reason.
2100,stock,114,Everybody oil no throw.
2101,future,181,Forget near fly yeah hold western series.
2102,bring,147,Last own perhaps success.
2103,road,185,Shoulder from peace finally far.
2104,production,161,Move work him new field Congress.
2105,opportunity,110,First civil case player away.
2106,owner,40,Few information beyond training cover about lead.
2107,rock,60,Significant form writer region right fear.
2108,thought,35,Section avoid weight plant various.
2109,attack,190,There sister show black.
2110,board,73,Significant very tend field.
2111,color,120,Seek from during young.
2112,realize,196,Discover here happen create through.
2113,offer,91,Cause light window shake good.
2114,early,181,Action ball become identify.
2115,suggest,41,System rich buy sort understand main.
2116,author,53,Less prove help director tough.
2117,necessary,115,Huge computer choose respond.
2118,ahead,165,Appear top may not tonight improve choice.
2119,perhaps,43,Score agreement account care no too small.
2120,still,38,Support kid shoulder evening.
2121,thought,200,Well listen yes all thousand tree.
2122,media,197,Name base agency card.
2123,Mr,159,Democratic good once kid there evidence place.
2124,age,135,Certain tree process your.
2125,brother,117,Trial program hair compare.
2126,attention,183,Raise poor something bar natural citizen.
2127,natural,154,Heart do worker development.
2128,government,194,Very face security although.
2129,public,19,Must officer rest purpose its option citizen.
2130,quickly,158,Adult mission task activity wait.
2131,more,114,Kind seven risk free soon style.
2132,successful,106,Western play type rock debate laugh since.
2133,firm,190,It level add recognize my.
2134,arm,80,Create fill air call certainly road.
2135,beat,165,Admit his key nearly quickly name pay.
2136,best,96,Music camera have almost reflect nice.
2137,cost,26,Thank power add prove off no car owner.
2138,trial,51,Common or police possible source them hot.
2139,treatment,130,Better my rock guess.
2140,sport,96,Continue under life without whether letter alone.
2141,against,140,Animal later turn mission do member.
2142,major,125,Guy month clear outside produce.
2143,record,19,Central bit wind hospital will father do.
2144,mean,79,Party TV bed vote.
2145,rich,146,Whose street walk language significant.
2146,industry,167,In agent wide participant whatever success radio.
2147,contain,33,Bag blood enough debate light.
2148,garden,47,Beat fish election doctor detail since surface.
2149,accept,71,Away today though help drive partner the.
2150,specific,34,Look still respond why meeting energy.
2151,simply,50,Organization finish make skin.
2152,road,72,Know half just boy opportunity painting.
2153,parent,184,Positive front through event hit.
2154,during,118,Key candidate time down.
2155,change,114,Happy sound research guess.
2156,offer,139,Simply determine final travel short.
2157,outside,197,Large parent feeling bring bill.
2158,event,98,Kind cup commercial can run economic.
2159,property,24,Whether series down baby provide various support.
2160,leg,138,Chair that evidence top. Stand hour full trade.
2161,activity,130,Dinner try commercial condition position recent.
2162,choose,79,Military nature have thing many.
2163,care,147,Happy morning life piece follow.
2164,child,97,If treatment half station draw.
2165,source,11,Finish after occur police realize.
2166,generation,16,Foreign just show much senior black also.
2167,wall,156,Factor few couple structure job.
2168,system,170,Check on identify piece.
2169,senior,78,Whether scene season season.
2170,many,167,Animal wonder medical family prepare.
2171,including,97,Expert term might claim case.
2172,any,36,Phone guy more area. In local price assume.
2173,office,55,Hear happy minute on question economic property.
2174,can,73,Every impact course gun without.
2175,bar,134,Human speak success next direction.
2176,sometimes,159,Half speech wear together.
2177,none,61,Morning forget history behavior star senior.
2178,north,135,Trip daughter during yet teach white window.
2179,address,197,Walk number responsibility.
2180,time,136,Sometimes dark live great join service.
2181,second,89,Consumer tonight save stock.
2182,could,14,Child factor foot agency south strong.
2183,remember,24,Him she mother simple. Well whose term chair.
2184,experience,54,Affect sort somebody training thousand.
2185,tough,63,Media economic among agree series surface firm.
2186,such,124,Because individual build customer.
2187,president,52,Really size back middle especially ten.
2188,trip,142,Exactly plant day whose meeting focus mouth.
2189,from,135,Can in perform common hot. Tree approach in us.
2190,really,66,Health yourself anything your election.
2191,city,55,Message ahead class ago deal.
2192,weight,174,Republican minute partner lot tree its wall.
2193,challenge,78,Sign enjoy study former scientist color.
2194,alone,48,Despite only picture forget can best vote.
2195,north,157,Hotel common worker defense.
2196,after,176,Hand set every college administration sell.
2197,stock,52,Their present still buy audience.
2198,ever,122,According against responsibility exist assume.
2199,star,26,End attorney bad seat two art.
2200,simply,189,Movement since scientist own color inside us.
2201,American,62,Model he soon get present age.
2202,through,64,Know official few consider market onto level.
2203,meeting,109,Win skin and weight standard already century.
2204,prove,105,Process word material pattern Mr anyone.
2205,majority,91,Share song listen hard bill.
2206,answer,105,Course seem set can. College Congress real.
2207,leave,182,Must follow shoulder policy.
2208,film,193,Another word statement.
2209,truth,58,Probably goal close hot science president yet.
2210,customer,51,Letter lay interesting.
2211,because,86,Where material detail amount.
2212,day,83,Move break operation drug.
2213,change,56,Movie system produce term attention drop film.
2214,rest,56,Make impact black room light same require wind.
2215,decide,172,Month past save them recently.
2216,imagine,111,Age around build may probably small.
2217,laugh,169,Perform peace long student.
2218,traditional,55,Reason suggest girl.
2219,inside,103,Offer five long effect pull apply film.
2220,month,191,Husband form if join consider.
2221,nor,192,To enter opportunity natural.
2222,laugh,13,Inside by say war.
2223,attack,24,Both civil run couple.
2224,apply,89,Physical when certain fact century poor pressure.
2225,house,167,Lot power myself we. Character if job will.
2226,media,69,Exist accept also price walk there.
2227,together,99,Partner agency gun rather create world economic.
2228,no,76,Way left woman stock address.
2229,happen,143,Political modern fire know ever.
2230,player,64,Role although interview detail serious ability.
2231,something,66,Catch animal down morning fact wall hair.
2232,speech,156,Role international let listen indicate.
2233,shake,192,Owner deep air capital wish.
2234,authority,81,Really politics task strong somebody.
2235,article,114,Option none nor with story manage method.
2236,media,134,Each box son.
2237,fall,122,Voice structure moment no ahead nearly blood.
2238,across,17,Admit career generation effect develop own.
2239,positive,181,Him floor now alone.
2240,live,181,Man Mr land listen.
2241,rate,76,Reach reduce technology true side.
2242,through,142,Theory great hotel special name table.
2243,table,123,Reveal girl rest same outside heart east.
2244,poor,49,Probably huge sound try yard rise.
2245,miss,62,Understand price compare fine.
2246,tough,97,Benefit run top successful.
2247,agree,173,Young night Mrs student. Trial mission way.
2248,next,120,Movement word successful window ball say.
2249,figure,89,Cut source upon.
2250,yard,147,Decide improve teach put.
2251,may,141,Activity sea create model above reflect.
2252,decade,71,To democratic rule dark feeling put.
2253,make,50,Recently candidate under spend push.
2254,special,134,Sound at enough marriage himself.
2255,cause,77,Plan cup treat some.
2256,safe,71,A their up brother time provide rich.
2257,want,77,Eat choose suddenly time avoid.
2258,painting,81,Century most civil law.
2259,time,90,Anyone pattern main idea each close plan.
2260,wait,85,Risk claim possible. Name provide relate wide.
2261,dream,23,Miss improve reflect sometimes listen.
2262,both,127,Wife rate role artist add.
2263,learn,67,While face window age every.
2264,push,73,Task read traditional difficult yet him.
2265,site,72,Rise particular fall let myself.
2266,miss,193,Several near own beyond.
2267,purpose,13,Cause item cup. Take hundred else special.
2268,be,132,Area common mission field hospital for.
2269,onto,178,Probably turn give drive.
2270,themselves,194,Day physical guess miss.
2271,want,156,Increase care herself thus kind off.
2272,bill,95,News perform find gun worker pattern.
2273,decade,38,Wonder thought where institution include action.
2274,miss,43,Series arrive western maintain just.
2275,billion,15,Success write lose anyone exactly head brother.
2276,offer,57,Usually human carry ago.
2277,purpose,147,Participant his economic speak including.
2278,reflect,123,Account seven risk four long stop member.
2279,win,16,Up side phone worker number approach building.
2280,situation,133,Before end five mean.
2281,let,146,Item think treatment possible campaign.
2282,wait,124,Company too floor course officer why.
2283,year,50,Mrs election senior.
2284,account,83,Chair word senior southern fine beautiful.
2285,cold,83,Everyone weight true power test.
2286,sing,147,Reflect field inside candidate agreement teach.
2287,there,126,Project bring medical decade picture.
2288,reach,147,Give goal course doctor song.
2289,table,101,Seven American message past space bit to.
2290,employee,51,Know model rest watch smile.
2291,likely,50,Whom power energy either design environment.
2292,produce,113,Least late say himself.
2293,wish,25,Popular industry senior.
2294,skill,99,Measure leave great name seven.
2295,hair,160,Woman though item sport spend edge.
2296,figure,130,Gas check close easy yourself.
2297,talk,67,Never none my bank save.
2298,join,65,Thank central his.
2299,throw,73,Performance citizen during reflect gas.
2300,customer,109,Yourself add hair.
2301,we,11,Power five partner many boy.
2302,organization,18,Just term remember part receive. Happy walk she.
2303,hundred,162,Eight recently over special it card store.
2304,either,64,Available movement up character commercial woman.
2305,southern,77,Heavy audience base create matter room lose.
2306,even,89,Control north party arm.
2307,they,110,History fund government third drug.
2308,turn,39,Water step simple lot evidence ago movie not.
2309,recognize,106,Sea interest spring certainly make others your.
2310,yes,173,Improve expert father seven save seek clearly.
2311,tonight,62,Kid yeah painting staff.
2312,others,88,Network better light campaign wrong very exist.
2313,stuff,22,Indicate cell decade may follow behind such.
2314,present,147,Morning the national sound.
2315,still,36,Car discover week.
2316,require,186,None claim model report book join amount.
2317,serve,93,While talk talk really blood consumer need true.
2318,clear,66,Task last key raise. Raise imagine soldier my.
2319,know,171,Feel watch action hair rich into yourself agent.
2320,instead,192,One executive measure.
2321,according,86,Claim month seven.
2322,woman,122,Professional learn follow threat learn.
2323,some,178,Adult commercial production.
2324,address,180,Stuff report necessary sell.
2325,long,200,Rate wall idea ask.
2326,simple,62,Quickly place yeah interview.
2327,service,173,Key analysis moment.
2328,front,21,Join risk financial consumer.
2329,beyond,172,However huge anything while analysis.
2330,that,142,Ago child peace within wonder base.
2331,catch,117,Itself policy shoulder pass include chair.
2332,result,54,Suddenly require reduce avoid accept bit drive.
2333,development,24,Dog tonight and fly them. Example but find.
2334,bag,29,Season huge every although success.
2335,maintain,119,Film foreign for statement. For security scene.
2336,page,11,Data local doctor concern.
2337,radio,93,Word with area pick church describe.
2338,agent,76,Cut truth should include.
2339,recent,200,Fly professor others color around.
2340,compare,35,Home recent heart base conference me respond.
2341,successful,163,Skill ten success paper movement.
2342,series,119,Never campaign apply top take establish last go.
2343,activity,180,Whom person why throughout life thing.
2344,leader,28,Discover let new voice economy right including.
2345,detail,154,Continue front generation police.
2346,century,113,So cultural only parent local success.
2347,blood,186,Board church fish thousand early.
2348,order,33,Fly herself short interest.
2349,truth,150,Bill remember give.
2350,go,112,Bit fire include.
2351,figure,195,School mention city now card.
2352,artist,156,Field month again might American before meeting.
2353,anyone,189,Itself economy kid dark face nothing.
2354,other,51,Continue example main thank together citizen.
2355,view,99,Drop entire strategy feel however.
2356,blood,199,Cold safe data entire cultural including agree.
2357,game,57,Magazine idea should keep rate.
2358,arrive,58,Record tree it create religious available begin.
2359,manager,28,So evening seven. Number we bit able fine might.
2360,effect,76,Reduce both forward eye hot kind.
2361,act,71,Oil early alone. Center and best admit.
2362,certainly,57,Put blue of fire.
2363,themselves,134,Last other pass dinner point and small member.
2364,agreement,37,One imagine compare eat PM teacher real company.
2365,pay,116,Share despite total interesting may.
2366,culture,175,Weight response on street.
2367,suggest,148,Tonight under yard actually out.
2368,than,193,Minute both black want reach special.
2369,sit,71,Church natural turn body she edge floor.
2370,itself,22,Knowledge collection note stand check.
2371,expert,30,These short artist reduce parent.
2372,seem,164,Instead money full involve realize the.
2373,everyone,51,Human reduce huge resource now rise organization.
2374,people,109,Community pull chance why lot image.
2375,three,22,Message answer them she.
2376,local,120,Focus kitchen tell none far other.
2377,join,146,Suggest suddenly thank their former sell bad.
2378,enjoy,166,Office where official yet kid.
2379,no,90,Else popular write class both.
2380,white,71,Important will parent western.
2381,region,168,Market man field not country.
2382,day,52,Late try career guess stage later away.
2383,particularly,86,Because else soon that itself.
2384,write,24,Full which unit while.
2385,character,35,Walk paper information customer past.
2386,source,41,Who artist which name.
2387,teach,80,Area wide smile.
2388,enough,139,Month ago painting term public.
2389,just,180,Common family knowledge wrong.
2390,beautiful,49,Shake campaign record himself.
2391,recent,50,Across music Mr partner part write.
2392,visit,19,Church just old red manage policy hair.
2393,off,80,Sometimes cold plant be rich without evidence.
2394,upon,116,Resource color according view discussion.
2395,defense,59,Industry notice simple guess before.
2396,pressure,167,Tend range education.
2397,sort,68,Identify those yourself soldier and store.
2398,compare,156,Agency benefit others assume court remain.
2399,guess,21,High contain read increase party stage.
2400,window,117,Point art amount road nearly.
2401,occur,196,It often behind go.
2402,reach,143,After officer simply practice election.
2403,the,161,Challenge form age value nearly fall people risk.
2404,chair,119,Whose decade health west.
2405,financial,182,Across stop hear town.
2406,go,159,Citizen five anyone many space put hotel.
2407,others,87,Security mention loss in born.
2408,religious,51,Where admit begin compare.
2409,seat,77,Loss entire information catch compare.
2410,wish,124,Easy total research security.
2411,TV,55,Your share stay trouble purpose poor policy.
2412,after,65,Why wall option end.
2413,adult,96,Economy today treatment ago police.
2414,or,125,Happen over within home.
2415,expert,145,Happen big lead learn first tell several plan.
2416,administration,83,Plan church few compare science.
2417,cut,97,Receive room reduce work enter.
2418,several,155,Defense together I draw season risk affect.
2419,rich,113,War fish pay whose pressure general away.
2420,huge,162,According have ten executive go gun wall.
2421,across,149,Item smile book matter there.
2422,in,165,Oil drop somebody build let follow.
2423,pressure,128,Attention low meeting large month.
2424,look,146,Suffer direction nature cut body.
2425,tree,183,Attorney walk itself true reason perhaps.
2426,read,183,Vote really build right back.
2427,coach,58,Building perform weight central.
2428,against,23,Protect toward news continue.
2429,let,170,Right quality class. Me there too much.
2430,appear,60,Whole view hospital first.
2431,shake,123,Window recent thought.
2432,way,134,Pick item already media.
2433,authority,108,Traditional note all score notice.
2434,remain,97,Talk name once amount trade half. Hand hit Mr.
2435,company,87,Any deal doctor ten Republican director.
2436,themselves,82,Part both talk Mr feeling building nor.
2437,carry,99,Field threat truth response the pass impact.
2438,quite,94,Decade leave check scene believe best.
2439,item,17,Go production mission site car ability open news.
2440,believe,55,Radio institution collection.
2441,continue,70,Western phone only always able knowledge include.
2442,important,174,Set Congress forward place nor exist senior.
2443,them,146,Most simply with kind machine skin.
2444,employee,128,Hope person body treat fire.
2445,simply,88,Policy charge go dream class.
2446,cup,96,Fall minute with will.
2447,yes,120,Employee politics mention.
2448,about,47,Stuff shoulder southern already compare task.
2449,school,167,Much history why pattern summer.
2450,house,156,East hear next behavior head.
2451,week,95,Work buy ability nothing strong official.
2452,impact,80,Resource medical policy kind life phone from.
2453,employee,20,Grow four arrive social station.
2454,follow,53,Try song area light.
2455,small,174,Air score over consider imagine.
2456,call,100,Pass itself meeting professional suddenly plant.
2457,individual,109,Voice example fire box.
2458,now,175,Smile not relate citizen rule everyone clearly.
2459,person,62,Special probably place.
2460,anything,111,Guess for significant where interesting.
2461,majority,192,Summer ability eight stuff begin station seem.
2462,behavior,134,Couple threat son house.
2463,upon,80,Some down draw. Thank very soon.
2464,offer,74,How measure produce professor.
2465,race,151,Own record religious eat ever himself.
2466,region,59,Professor reveal agree live.
2467,house,43,Rate scientist decide modern.
2468,throw,29,House field item party study.
2469,now,109,Him difference positive year medical ground turn.
2470,music,188,Place method get tree painting tax.
2471,second,31,Order top particular catch success.
2472,away,132,Somebody cause class natural hospital rock.
2473,difficult,188,Weight trouble see somebody market defense.
2474,machine,109,Reach civil peace develop prepare.
2475,material,65,Physical yes up industry contain world.
2476,of,101,Spend American memory choose strong data.
2477,life,68,Page environment better.
2478,Republican,181,Detail medical officer score positive body.
2479,science,95,Space feeling I interview animal give.
2480,fire,148,Process test behind defense toward mean hot.
2481,evidence,26,Citizen matter decide when write gun.
2482,edge,37,Million them third majority next bar difficult.
2483,radio,92,He back degree read let. Order act major.
2484,system,45,Piece wait matter measure time.
2485,defense,127,Seat name serve finally response.
2486,wear,137,Spring hold lay green choice specific four.
2487,month,30,Catch real war detail check it. Rock hit get.
2488,itself,177,Television spend debate guess just.
2489,wide,141,Because carry stop media service hand suggest.
2490,church,28,Pm star house break.
2491,art,130,National behavior letter available.
2492,particular,94,Enjoy world cover old.
2493,ahead,81,Success plan approach not lead.
2494,PM,147,Mission instead hot opportunity her sing forget.
2495,other,53,Move state discuss lawyer science fine.
2496,series,152,School sign customer herself same.
2497,during,51,Recent they south fact name truth.
2498,me,24,Card government remain chair box.
2499,fire,126,Alone century start each without.
2500,those,30,Indeed according none member across star.
2501,the,21,So sense city happy cell order benefit series.
2502,must,115,Smile vote moment much first sport.
2503,network,40,Add practice control state author speak fast.
2504,idea,14,Finish ok nearly catch. Animal gun play bar.
2505,positive,118,Prove police low thought yeah crime job.
2506,across,44,Matter statement indeed.
2507,or,163,International where must car stock place.
2508,finally,15,Thank clearly impact represent building detail.
2509,can,114,Allow century second sign leader identify.
2510,reduce,154,Stand turn three write.
2511,wish,194,From issue force help that society.
2512,respond,142,Cell easy loss.
2513,serve,170,Manage lose care coach skill.
2514,real,183,Certainly program source suggest town.
2515,speak,137,Discuss us letter rise.
2516,serious,120,Thing method travel.
2517,sound,100,Region building perform call.
2518,for,141,Take also watch easy respond.
2519,must,97,Save people sign. Clearly wrong lay national.
2520,loss,148,Tell customer social draw than.
2521,again,90,Two religious certainly city step fish.
2522,off,161,Simple such happy thought agency citizen.
2523,director,163,Week present eight investment make human again.
2524,long,97,National gas size hotel so free baby.
2525,everything,147,Space reason education car win he.
2526,stay,15,We bar theory simply receive.
2527,part,55,Without choose past work perhaps age economy.
2528,large,105,Section late three member practice structure.
2529,him,121,Tend same recognize five door answer.
2530,assume,57,Leave which election.
2531,instead,118,Security important everyone sell week.
2532,watch,44,Tv gas arrive.
2533,analysis,196,Street try amount party sea skill.
2534,opportunity,134,Network matter player education former.
2535,grow,155,During defense everyone until.
2536,protect,173,Wish business Democrat tax.
2537,society,92,Expert because policy minute quickly hand born.
2538,just,71,Whole group way goal power report tough all.
2539,do,104,Break against management type mission box.
2540,radio,115,Learn arm management natural difficult.
2541,enough,131,Fund store institution partner hear floor.
2542,drive,96,Thing despite individual happen.
2543,report,24,Store these during impact worker.
2544,draw,44,Control trade not along whom yard.
2545,push,145,Star fast never indeed meeting bit.
2546,method,86,Gas ahead Mr by great face.
2547,body,153,Top it threat full although.
2548,whole,102,According many affect player plan firm now.
2549,very,157,Allow note left single five garden.
2550,do,71,Bar news part property beautiful.
2551,matter,64,Policy model of study focus town safe space.
2552,federal,46,Organization with firm Democrat.
